<?xml version="1.0" encoding="UTF-8"?>

<!ELEMENT company (employee, client)>
<!ELEMENT employee (name, number, password)>
<!ELEMENT client (name, email, password)>
<!ELEMENT name (#PCDATA)>
<!ELEMENT number (#PCDATA)>
<!ELEMENT email (#PCDATA)>
<!ELEMENT password (#PCDATA)>
